please please please open a store in the UK,1
Need to try this !!!!,1
I want one of each jasper,1
"they're a decent alternative if you're feeling something sweetxe2x80xa6 i've had all 3 flavors, like blueberry best",1
"Nah, I still don't drink it.",1
I want one,1
trippin all of em is ham,1
I absolutely love the lime and sea salt!!,1
"Works always - love it, your mint leave looks perfect!",1
I have Batch 006 - one of the best Laphroaig I ever had!,1
a those cookies r insane,1
Being out of school!,1
Are single day tickets going to be made available ??,1
Ok this is everything want your life!!!!,1
I can get that chicken sandwich whenever I want #popeys,1
Oh how are they?,1
They are my fav,1
Cinquo hombres wins + that extra pour inside the bag,1
cheers will it save until Tuesday cos I'm not in tomorrow !!,1
I doubt you'd want want them psychotic beady cunt things looking back at you dude,1
_tha_tiz_ank I want them!,1
I want please,1
I also tried this one and thought it was too sweet for my liking! I needa try the pumpkin spice though Your body needs fuel no matter what after a workout and this is a perfect post workout snack to replenish your body with what it needs!,1
Oh how bad i want these fuckers back,1
.mrsharrison OMGG NO WAYYYY I need these,1
we should get the pumpkin spice for fall day!,1
Yum these have my name on it,1
Anyone try this yet? Id love to hear tasting notes.,1
"LOL, well me and a northerner out drank the pub in Waterloo this evening.",1
I See You Such a kickass shot! I have to get after this stuff. Never tried it!,1
Where can i Buy it??,1
"Hi Aimee, could you please DM us details so we can look into fixing this for you :)?",1
I want this,1
Oh uhhh i'll take both,1
Going to have to get hubby to try these! I cant handle the heat.,1
if you're high right now you should follow us,1
Where can I buy them im living in the netherlands but i cant find it,1
Im still going to try them,1
I will def be trying these,1
I need a beer right now. Like RIGHT NOW.,1
"_o2 nah bruh..im out to sea right now, which means no cell phone service",1
Also we didnt try on the onesie- its a photo we grabbed from google !,1
I'm thankful to have a life that may be far better than anyone deserves.,1
"Oh, food, yeti pop and cake. Yes please! Skl och tack! (Cheers and thank you! But you know those Swedish words, I think). I love the cake, and the eye makeup she has in an earlier post, inspired by the red devil.",1
stole some at the pub that had it cause it was so good. Glad I can legally get it and was only $3. Gone taste them all now,1
My birthdays in a few days I hope I get this,1
bring back the kfc kids meals omfg!!!!,1
Oh fun!! I need these for my daughter,1
"Well, This is what I want",1
I need to have chocolate,1
Wooo~~ excited to try these!,1
I buy them geez no go list is longer,1
.snackqueen I want one,1
I wanna try,1
We should get some for when you come to visit.,1
"Brunch is my fave any day!! My fave movie snack is Reeses Peanut Butter Cups!! P.S. how many times did you have to throw the milk duds to get this shot, or was it on the first try? I just have to know",1
Ive bought the white Tob from Australian Candy stores . Im keen to try the Fruit&Nut next,1
omg i need that in my life,1
I had to take a nap lol day drinking got me sleepy,1
#deviljuice Haha jk.. just called it soda haha.,1
I cant wait to try these!!!,1
Happy birthday gorgeous!!!,1
Both! then you won't have to decide :P,1
guess Ill have to start buying both now. Allocating money to the taco budget,1
I'm gonna have to try that one,1
I need that in my life asap,1
Im gonna have to try this,1
I need these,1
Your neighbours sound rather nice? Are most people young workers who want a good deal not too far from work? I guess I could say the people in my area value different things to me.,1
Ok I believe we shouldn't visit the supermarket,1
80's fantastic memories...,1
I have to go to target ASAP! !!!!,1
"What a great face m, ours has exactly the same one",1
I need all of dis. ASAP.,1
awesome!! I cant wait to try it!!,1
"created recipe 32705460 using default BMW driving template. No logs, data, or errors. Any ideas?",1
Didnt know this! Now im rushing to the shops,1
it'd have to be surge pricing 24/7 to get me to do someone else's dishes.,1
Is the UK going to get them because they look amazing,1
coming now bruz,1
_llama_ where in the States?,1
It took you long enough,1
Vernors is the best!!!!,1
Those are really good and I get them for cheap at Ross Dress for Less,1
_ j trying to impress u,1
I actually really enjoyed pucker upper!,1
I LOVE butta fingah !!!!! Ill have to try this version,1
Bring biggie fries back !!!!!,1
wait is that just a box of rice... UHHH u needa a side entree w that it somethinnnnnn,1
Massively jealous!!!,1
Ill be there in spirit,1
Why chocolate ice cream tho . We want vanilla!!!!,1
"I seen these bottles at the store last night. Told """"Santa"""" that's what I want in my stocking lol",1
Lovely place to relaxso charming,1
_ we still need to try the hazelnut chocolate ones,1
I don't need you preaching social justice causes at me .nnYou making fucking CHIPS.nnYou just lost a customer.,1
Where do you get them from they look so good,1
That's so awesome! I need that cup 030!,1
I want some but hold the coconut,1
"the big one I can tell you is amazing (bought it multiple times now), the small one I have not tried yet. I'll let you know when I do and what I think of it",1
Love both. #TeamSnickers when I want Chocolate when I want chocolate and #TeamSkittles when I want fruity.,1
What flavour is it?,1
I want this to celebrate my Halloween in the perfect mood,1
Horribles sus chocolates,1
Whens the dinner party?,1
"So cute! Happy International Womens Day, babe!",1
"They should sell soup there, since you wont be able to get the Soup on E! anymore. #BOO #HISS",1
Im there with you we want mf smores !!!,1
Can't wait to try these,1
yes you saw how we danced and how I sang to her. so romantic,1
fucccckkkkk. That 32 took me a whole day to drink,1
There are no A&Ws near me! . I did get out to when I was home in Chicago at your North Aurora location and the root beer was delicious! I tried to buy a mug but they were all out so... #FREEMUGFRIDAY !,1
Where can I buy this ?,1
Hi - can you give us more free food so we can make more memories?,1
Beyond awesome. Congrats. #cheers,1
Bring em back. I wanna try these!!,1
"in english it's common to say ""there's zero X"" as in zero percent. ""zero possibility of misunderstanding"" $semicolon$)",1
That is a wild one,1
Interesting read! As always . The watch and the bottle are amazing,1
Were down for this action.,1
Chewy no questions,1
Im all about the gin,1
Want all the flavours!!,1
How can I get this?,1
That Boone county 12 year is an underrated bourbon for sure . I have to go to Texas to get bottles back here in San Diego but its worth it .,1
TAKE MY MONEY!!!,1
who wants Guiness?? i do!! i do!!!,1
CUTE,1
"I've subscribed to talks YouTube channel and I absolutely love you and Joshs videos I watch them as soon as they come out!! I am so ready for the next video:) PS, I've also followed both of yall on intsagram and like all of yalls recent pictures I'm ready to see who the winner is and I'm hoping I get a chance to win!!!!!",1
infinity cornflakes over both,1
we need to find these,1
__91 please we need this,1
Bring back the seeds!!!!!!,1
Ohh I could need that right now,1
it's actually good af,1
can we get this.,1
Must!!!! How can i get them!!!,1
Bernie actually has a lot of votes.. Hillary is just leading with a notch more.. What's this nonsense of Bernie having no votes??,1
"I've already got a Mercedes themed tree, and 44 on the top",1
We need more of this,1
"Chelsea team photoshoot day at Cobham: David Luiz, Gary Cahill, Marcos Alonso, Branislav Ivanovic. #CFCpic.twitter.com/WciQJEK38a",1
peanut butter,1
I need some chocolates,1
Ahhh!!! I gotta have this one,1
Minion taffy?! Where do i find those?!,1
Want to try that!!,1
Lol I'm just sayin,1
"Ah Im definitely going to try the treasures, do you know how long theyre out for?",1
This reminds me of my childhood,1
You should join the Miss Universe pageant :),1
Yums!! Can I find this in Singapore?,1
What a lovely idea. Advents with no food . I want one.,1
I want some aprihop!!,1
I want these,1
Something sweet always brightens up the mood! Why not join us for a chocolaty brownie someday? :) Call: 04430833520,1
LMAOO I wanna try,1
Sam Calagione is #BeerJesus,1
"_Hoyt Glad you liked it! Sorry it was late, love youu!",1
That is an unbelievable price. Buy the pallet.,1
I need dis!,1
_1375 its a must try lol,1
Bk be carful out there!,1
_Glass The contents are Bill Cosby.,1
That's an awfully specific flavor haha...,1
There is a NASCAR rat. People aren't that good with help,1
Knowing more than one language is a blessing! Maybe if she understood what he was saying it wouldnt have been a problem,1
Halloween oreos,1
Looks refreshing,1
Yes!! I have one friend who talks at you. I worry in the same though!! How are you?,1
I'm in the lab cooking open your ears up it's time,1
Beautiful view!,1
I want one of both!,1
Omg I need this Love it,1
Taco Bell before 10pm? at least get chipotle,1
Sounds like a something I need to try,1
And now I want a hot fish sandwich,1
"Ice cream, salted caramel, my obsession too!!!! Cant get enough!!! Yummy",1
_Carlos50 come now! Still plenty left,1
Wow I want them all,1
I WANT 20,1
I hv not try smarties but I love m&m(peanut) n skittles.,1
"I also dread showers. Once Im in the shower I love it, but the process of getting to that point for some reason just makes me exhausted thinking about it. glad Im not alone!",1
is still STLB in the greater St Louis area$semicolon$ Panera is just elsewhere,1
Those flowers are beautiful! Happy Sunday!,1
"Keeping Pappy, never having Bookers again",1
Im looking forward to trying this! How does it taste?,1
Where did you find the oatmeal cream pie?,1
"Chocolate is the ultimate food form of love, so absolutely :-)",1
Hahaha Doooom,1
How do I get one?? Are they at Davidsons?,1
Are they good?,1
I want #alwayshungryph,1
I want one please,1
Gotta find these,1
really?!? We've only had the gogo squeeze apple sauce ones!!! I want to try them!!,1
Well you can get rid of everything but reese's and twix,1
Wow this is we need more artist like you on,1
"That shit is better off in the trash, let the rats eat it, give kids real food",1
Anthony and Rob Bynes two faves,1
ugh i want some even more,1
_sheward I want one,1
morning! Thanks.,1
Is there a way I can get it shipped to the us,1
We're glad you enjoy,1
I want to try it!,1
Nothing like a $40 4 pack!! Lol,1
Cannot wait to find these,1
Jimmie's going to get se7en. Go 48!!,1
Bring back banana foster please!!,1
PLEASE LORD I NEED THAT!,1
Dr. Strange is missing,1
Yummmmm! I literally want all of that in my belly right now,1
Yea man! I get home tomorrow so I'll buy it than. That cool?,1
"Can't find it, haven't tried it. Sad day all around",1
Did you get mashed potatoes and biscuits?,1
Get the Cadbury bytes backkkkkkk!!!!!!!!!,1
Have you got any for sale?,1
"definitely, y'all have to try it.",1
Congratulations! Us locals will all remember where and how you started. Making #sussexcounty proud.,1
where can I buy them?,1
Omg That sounds so good!!!Where did you find em?,1
Damn never seen the big size white twix. I neeed it!,1
any good? Never been to Chick-Fil-A!,1
Such a grt shot,1
Dude where do u guys get these???,1
Hells yeah! Imma get some!,1
xe2x80x9c: Need this in my house right now! #jackdaniels #bestdrinkever #loveit pic.twitter.com/e4dMSmKeR9xe2x80x9d why? Haha,1
I want this right now...,1
Awesome keep crushin it!,1
_o want any???,1
Cant wait to find these babies!!!!!!!,1
I hope they come to a store near me,1
can you guys get me in pleassseeeee??????,1
Happy birthday!! Cant wait for the giveaway!!,1
_yablonski I mean I'd certainly try it,1
Where do get them?? I don't see them inshops,1
Where did you find this at I googled it and couldnt find anything about it,1
I need this in my life!,1
"I didn't like them...love brittle, love peanut m&ms but it tasted weird almost burnt or a strong toffee taste.",1
Wow Where did you get that?,1
looks like I'll be having Chick-fil-A for dinner tonight!,1
"Ok I honestly rarely read the blog but Im so glad I did on this one... Alexa, wheres my $50,000? Cant wait to try these!",1
"Cant pick, all of them",1
Damn i wish i was those pocky sticks,1
trolling,1
No I don't - can I have one please? I can send and SAE...,1
"Yep, and tinned food now down from the old 400+ grammes, many now 300g but same price. Disgusting!",1
_US wait...I don't I've seen this flavour north of the border! please tell me you ship this to Canada so I can start hunting! :),1
of wks okay bruh thanks idk what I'm throwing either,1
workin?,1
What?! I need this!,1
I still have to try that barrel strength bourbon...,1
Don't forget to retweet this if you want to enter the giveaway!!,1
Congratulations!!!!! October is an AWESOME month! I became a Mom for the first time to a beautiful baby girl on 10/12/71 and she made me a grandma to a beautiful baby girl on 10/05/00!!,1
"Never had them frozen, will try",1
Yum!! Where do you buy the sausage jerky??,1
Yummm love the buttery taste of Ritz so these must be amazing!,1
Sounds amazing! Very original. Can't wait to try it one day!,1
Dang such a beautiful shot ! I need shot,1
I just threw up in my mouth even thinking about them. What kind of crust pairs with sugary orange?,1
Old Scout Single Barrel is one Id like to try.,1
Yesssssssss wa I like um !!! Come baby yuh sweet,1
I definitely need one of these at the moment,1
Where do u even find these?,1
Oh gosh! Now I wanna treat myself with chocolate too!,1
DRAFT DEFENSE,1
I want to try this!,1
All weekend long BB,1
what store did you find these at ?,1
Wow! Yummy. I will try this,1
I need that!!,1
All!!! These were sooooooo good def a mixed choc fave. I brought a bag to work and they were gone in a few hours,1
Now that is a line up.. but after recently tasting the bookers 30. I would grab it and run!,1
"I wanna play, me too please",1
Definitely want to try one of those,1
The one and only babe!!!,1
What!?! These sound so yummy! I will have to check for them next time I am at Walmart!,1
i would love this at the burger king near work,1
Beautiful Sienna!,1
all the very best!!!!,1
Can U dm the price plz,1
How can i get this deal? Im in Michigan,1
Nabati chocolate // always awesome,1
Wtf is a selfie stick and why are they a thing,1
_1 you the king of liquor and chill,1
_Lover_Ash honestly I don't even care anymore.,1
To me it tastes like a Mountain Dew creamsicle,1
Need to try this one!,1
nice Guinea Pig lolol jk,1
Ill take some of that my friend,1
Get the big jenga...,1
that's what we call High Class White Trash! I am liking the shatterproof! That's fancy! Must b2 stop homeless/homeless crime,1
That is just what I need right now,1
I wanna find these,1
Where do you get these at!?!?,1
"You've seen the bear in the Toblerone logo, right?",1
Looks good,1
Ill be in Sunday night. Can you save me one?,1
that is the sort of tweet I like to see,1
Great shot of the QA on your feed. I still need to try that one.,1
Is Pepsi Next available in stores? I hope there are bottle versions and not the can version of Pepsi Next.,1
"Ya we'll have to see, usually when we get 120 in Denver it sells out quick so I grabbed a bottle when I found it. I've heard mixed reviews about it, so I'm going to try it and decide for myself. I'm willing to try any beer once.",1
Mate I am driving the 30 minute drive to Asda's later to get these,1
_mang oka. Need these,1
That's the only alcoholic drink I can take.,1
"Need a Rocky Mountain coors, Budweiser and Busch one please lol",1
I really want to try the pumpkin rolls!! Maybe after my cleanse,1
Whattttttttttttt whereeeeee u get this,1
Sick all around I need to get some of those sticks!!,1
like i'm not cute.pic.twitter.com/7LJcHMsVYW,1
I just went to their Instagram page and told them why I will not buy their products. It felt good.,1
Where did you get the pink one?,1
_Swimsuit so hot,1
Bring me some frosted flakes,1
Where do we get to vote hahah?,1
"nnMMA Latest News has a great following, it's worldwide, plenty of metalheads! Hit me up n #PodcastsWeWantJastaOn",1
have yet to try the 4roses,1
_83 but of course! Ha.,1
Im gonna have some rye whiskey tonight,1
Does that include my natural birthday suit? Does feeling like a count? Lol! I need the laugh,1
Waow..awesome shot man. Love the mood and the light.,1
Sad thing is we live in a world where they will probably get a news segment and the manager will probably fired. He shouldve thrown hot fries in they face,1
"Wow, have to get some of that",1
"I think reporting posts may be a tad too far, but I think it's a great idea to talk privately with other craft beer fans and spread the word about ignoring BCBS this year by 1) Not posting about it and 2) not liking/commenting on other people's posts about it. I took down my big beer posts from this page (I think I got them all, but if I haven't, let me know), and have started unfollowing pages where I see big beer posted regularly. It'll be hard to silence the BCBS machine, but hopefully we can suck all the air out of the room and make a difference",1
Im so behind. I need to catch up,1
I love the honey ones! Wouldn't mind trying these,1
I had never try dark chocolate until I started the 28 challenge. The only one I have bought is 90% its not sweet. I'm going try the ones you bought hopefully I found one I like. Which one is you favorite?,1
And cask strength really.,1
#killashawgloves,1
can we get one when Im hone,1
Make sure they send San Francisco,1
It's the paradise! \o/,1
_leigh give me all of it,1
yep been there,1
"she's so cute ): i can't wait to meet them fkdmgl some will be here at the end of the year, i'm praying a lot for shay to come",1
Im definitely buying some!!!,1
Omg babe if u can buy me 5 of these ill buy you the Jordan's in February!,1
I will try,1
Just saw these in our stores in India as well. Have to try one....,1
Thanks again can't wait to make these xxx,1
You look amazing beautiful inside and out,1
#homesweethome #catmom #houseandhome #neutraldecor #grateful #housetohome #thankyouthankyouthankyou #woodsandwhites #neutralhome #myneutralnest #cottagestyle #classichome #cozyhome #guestroom #cottagedecor #farmhousestyle #simplifying #farmhousedecor #organization #hurricaneprep #cookies #clifbar #heb #blackandwhitecookie #catchow,1
Nice one!! Follow us and you'll always know what national day it is!,1
"Read the comments,",1
Unreleased selfies,1
Awesome Cey!! I hope to drink a 30 pack,1
omg kit kats are my favourite i need this,1
_boy11 broo i want this any how...,1
"Yummy ..... Cadbury....I really want to enjoy it....do u _toxic , ,",1
where you get those from,1
tight.. will buy if,1
That shit smell so good. I won't even allow my sister to wear it around me lol,1
Want to try these so bad,1
Excuse me. I have to go to BK now,1
Where can I find these?,1
please send me some !!,1
._.avocado .kassem _habiba I really want them,1
beautiful,1
see Jac! Even Applebees wants us to get it! Help me out here Apps..,1
Wow! I must try these!,1
_eire am I an ABG?! Yes!! Ill take a bag + boba. Thanks!,1
Drone for sure!,1
Im dying to try this. I hope I can find it soon in Canada,1
I like the way you layout your pictures ....,1
"One word,Astonishing",1
I must haves!!!,1
we still need to find this and eat it allllllllll,1
Do not want to be associated with a disgraceful brand like,1
From my bad habit,1
I need to try all those!!,1
Wow this is a beautiful pic!,1
"Ok, now this is epic.",1
omg you haveee to get those!!!,1
This is so cute. Can you message me pricing,1
Omg must try,1
Need,1
give it a try _pardelli _1881 .yahx,1
Omg really need to find and try these,1
Oh my!!!! Now you are going to make me get off my diet already on my day #3! Lol,1
thats part of the problem. People spending 1k on PVW15 dont have any sense to begin with!,1
This is very artistic. Well-done!!!,1
I need these in my life. I dont even care for strawberries,1
Looks like Im going to Target today lol,1
Ok wait was this on the wrapper or did you write it?!,1
_official want,1
Batman probably never lets him forget it.,1
Im buying you some,1
This bitch waited til I grew up?!,1
Where can I buy this?,1
Kubi loves that!! What do you think about my posts? [=)],1
Forget about the milk and cereal sis you finnneeee but cereal first,1
Mine would be ardbeg 10. I always have a bottle. Nice range of laphroiag!,1
Thank you. Ill check one out. My son will flip his lid over this.,1
thank youuu aw aw,1
"So beautiful , If you ever need some beautiful minimalist watches! Dont hesitate to checkout our page!",1
"Hey, that's a gorgeous shot!",1
I ain't no grass,1
"thats awesome, I will definitely be going to go find those.",1
Yes they need to bring it back! _saucedo,1
"Miss ya, bro! Gotta arrange something soon! Hugs!",1
:(,1
I gotta try this,1
where?!!! I need them!,1
this is in Portland. Plz tell me you can find them. I will pay you for them.,1
"I think your barista botched it! Mine was so delicious and the pumpkin carried through, and no straw next time! The flavor is in the foam",1
I love this sooo much!,1
I am fucking here for these,1
"never heard of baked Cheetos, but I'll be on a mission today- will stop into every bodega en route to work!",1
"I've seen all these except the almonds ice cream, and Russell Stovers! I need to find all of them! thanks for sharing love you!",1
Nooo. No microwave in Thames boyyyy.,1
We need that here,1
You guys should have stopped by and seen the baby :(,1
You shouldn't want to look 18. That's weird.,1
I want one so bad,1
Got to admit they are amazing! Not often in corbridge but next time im there it will be the first place i go!,1
Have a great evening,1
File under #MeTooGimmickry,1
I really want to try this!,1
Can I have them all?,1
I want some,1
What! NOOOOO! The spiced is so good!,1
No matter what. Always with you.Today I saw you in Motorland Aragon,1
Damn I'm jelly I live in Eastern Washington state up here In the far North. I want that banana milk,1
I need these yummies in my life stat!,1
#girlpower! Meet,1
Yeah I would need this,1
"Happy New Year to you too, my dear friend!!!!!!",1
"Oh god I don't think I could just stop. These are my substitute for cigarettes lol. The oral fixation needs to be fulfilled! I have like 5 empty tins of these things around my room and in my purse. I will probably stop eventually, but it will not be this day lol",1
10!,1
_s14 I need these.,1
Now I wish I was pregnant,1
Damn I want Hubba Hubba so bad!,1
Hmmmm not sure I will need to try this one lol,1
Hard fun day but so happy with all the work we got done .,1
Reply with your favorite flavor of .,1
OMG I need to try this flavor ASAP!,1
#evoSPEED it was Lovely!! I want this!!!,1
we need this,1
I'll have to get a bottle asap,1
Always a good time for a nice drink!,1
duuuuude. please bring cheddar kangaroos into the office. ill compensate you!,1
Haven't tried it. But it looks wrong,1
I absolutely like that composition,1
Please could you vote me for 'best multifandom account' in,1
I'll try them. Nat & I are the coconut lovers here!,1
"that's great, ran! fly high, my friend!",1
_smith_15 we need it,1
"We're giving away 5 delicious LINDOR Strawberries and Cream boxes, just RT to enter! Ts&Cs:",1
Those are my fav! The salt and vinegar and my actually all time fav chip!,1
You can keep Anthem... GIVE ME DA CHOCOLATE!,1
Open it please! I want to try some,1
omg I want there,1
i wish i could teleport to starbucks and get food there everyday,1
Still need to try these!,1
Blimey ... Where did you find that?,1
its all a balancing act WOWWWWWW,1
Omg I need these. Cuz they're sparkly,1
Wowwwww surprising results!,1
I wanna try these yum!!,1
we need to go now,1
"Yuuuuuummmmmmmm, think I'll grab a bag of cherries today",1
well actually it isn't drinkable it's like hard,1
"If he gave it to you, he mustve meant you to enjoy it once the kid is here and hes volunteering to babysit!",1
Pro tip: you don't even need a hand to eat a GoGo,1
I pray to God they bring these back I love waffles,1
I definitely need that #FridayFeeling on #winitwednesdaypic.twitter.com/cd1Cj4ne0p,1
Come and check out our page!,1
Yes it is,1
I wanna try this one the most out of them all I love raspberries,1
I will have to seek some out,1
Anyone who tells me Twix is not the best halloween candy can eat it,1
Looks great bro Cheers and have a good one,1
course brotha! #skamartist,1
those look amazing but I've never seen them in Australian stores :(,1
where are these sold? My sons need ASAP,1
I sure did! About to have a tasting panel of four go through and score all the recipes and will post the results after we wrap it up in a few weeks.,1
_greggyb I need,1
Ooo I'm interested. Try it once,1
Willet rye please,1
What a lineup!Ha en skn Sndag.,1
Want,1
"Where you at the event, didn't see u",1
buy me some dad,1
Omygoooosh I want,1
looks like I'll be taking a trip to the grocery store soon...,1
Love it. I need to get a little Binnington for my whiskey shelf,1
I want some,1
We don't have pumpkin stuff in Norway i want that too,1
_Kijkt_YT @_ST17_ give me,1
That shirt is If you need some carry along style check out the archives of Gucci bags,1
_murrayjr need these now,1
want to be ibfs?,1
I want some chips,1
Yum! get in my belly!,1
Ohhhhh I would love to try some of those! We have some in Austin that are delicious,1
