I need this whisky on my birthday,1
He's got the Jack ! dope shot you awesome fella,1
oh fuck hahaha,1
I haven't yet. I'll give it a go!,1
__spirit NEED,1
To the #AFL360pic.twitter.com/uxGFbfVlzT,1
What can I do to get a bottle shipped out to Arizona?,1
This looks absolutely dreamy! I want it!,1
ugh i NEED to try these,1
Pepsi pls!! I want the opposite of Coke this is gorgeous,1
I promise you the blue raspberry is the best but the last time they did this they had the blue raspberry which is when I first tried it and they had a tropical punch which was pineapple and that was the ultimate best!! It was always out when I would try to get another,1
okay and bring my umbrella hihi,1
lovely polo tyvm 4 the chance #countmein please,1
I'll take 1..,1
Founder and owner...!,1
I heard about these! Bring some over for us to try!! That and the chicken and waffles....,1
I love u,1
omg i neeed this x...x,1
Well arent you a lucky dude gotta try to find one of these!,1
Ahhhh too cool! Give him a hug from me pls!!!!!,1
Just send it on over I'll take care of it for ya man,1
I bought Chocolate Peanut Butter Pop Tarts at Walmart a few weeks ago and my husband and I are obsessed!! We have looked at every grocery store since then and can't find them. What happened and how do I get some???,1
Thanks for sharing going to pick these up later!,1
Awesome all we need is peanuts...!!,1
You are all adorable!!,1
Yall got anymore of those discount codes -in my dave Chappell voice or can we still buy tickets at the door tonight?,1
100% trying these,1
We plan out our breakfast for each morning so that there are no incidents in the mornings when we are rushing to get ready,1
"This seems quite delicious. Haven't tried any food dough yet, though I've heard that cookie dough is amazing.",1
I must try th we,1
something disappointing because vegan ice cream sounds disappointing,1
Can someone help me out please,1
Where do you find it in Calgary?,1
This is awesome! I would love to taste this!!! FYI,1
"This is unbelievable. This isn't a fuckin book report. You can't just use someone else's! Jesus, I need a drink...",1
Damn! I want one too would love to take a sip in that sunset,1
Where can i find these???,1
I need,1
you want to go?,1
Love the Lore. I'll put this on the list for the next time at travel retail. -JTR,1
Simple invite would be appreciated.,1
"I just dont ever go there, to be honest. Its maybe because Im spoilt for choice? You posting it makes me want to revisit it but I cant see it happening Jan I just think theres other gins that are more for me",1
Now I want the bud ice penguin & the bud-wiseee-errr frogs,1
I can't wait to get mine!,1
It would be interesting to try the cinnamon Coca Cola & the Sprite Winter Spiced Cranberry sounds like the Sierra Mist one.,1
I want it all,1
"Yes I do, maybe I will try this",1
You have great taste,1
Not if I get there first,1
".x3 im not even sure I would like it and I think they only sell it in the UK, but it supports the MPT so if I can find it, Ill buy it",1
.hack.9 we have to find these,1
7up is all time fav softdrink and i m surely gonna grab a bottle to try my luck,1
O wanna try this,1
Such a great pic,1
i think it's some pizza chain they have in like every mall,1
I love my weekends because of my #FavoriteSport #NASCAR #XFINITYSeries #SprintCup #Racing #BoogityBoogity,1
Excellent work bro .keep it up . May u achieve more success in your life,1
You live a charmed life kiddo,1
"I dont even drink Ciroc, but o need this!",1
gonna try the blueberry in my coffee!,1
I loved your recent posts! Wanna collab? Dm us,1
I want a chocolate cake mreowwwwww,1
"Saigon Sandwich is also an option. A tasty, tasty option.",1
it's about time u invite me to a game #wontMissIt,1
I LOVE my dogfish/spiegelau IPA glass :),1
Cheetos are literal life! Now I want some.......,1
"college kid inside, chubbies addict on the outside.",1
I think a lot are just trying to help so you don't get an injury.,1
Give me a margarita any day,1
I have never seen that before! Looks like fruit loops,1
Give me all please,1
I'd give the jalapeo one a go. Chili chocolate is surprisingly good,1
Gotta try these!,1
#CherryColaSurprise #TicTacnGot Surprised When I Asked Friends Whose Dimple is Best Most Of Them Voted For Me Instead Of Starspic.twitter.com/gCQYTGqmGT,1
no I love the orange one,1
I feel your pain.,1
I want to find it and try it ! Even if it was not 10/10 New icecreams are nice to try,1
Will try this,1
Thats my girl! Goldfish for days!,1
How can I buy one in Hawaii? I moved out here but no micheladas!! Are u going to be selling them online?,1
Really?! Cause I'm flying back tonight at 8:30pm! I want them cookies!,1
#1 Blantons of course!,1
Yes please. Can't wait to get my teeth into them.,1
So many Unicorns!,1
Looks like a good day out that!,1
I would try it,1
Because she needs some good luck after an awful year,1
Omg. I cant wait to try this! Thank you for sharing a thorough review.,1
Wow is all I can say - it is going to be amazing!!,1
Cookie Crisp,1
Yum this is making us thirsty!,1
Why is the coke orange,1
Oh man! I was hoping to get those! I havent gotten a Crowdtap sample in quite awhile!,1
did you buy any? Wonder what it tastes like.,1
Now i really want a gin and tonic,1
_1995 I like buying the 10 packs because it will last me a whole week when I drink two cans a day.,1
Where you get this from,1
I'm a little scared of the meat flavored chips but I'll try anything once. I have high hopes for the truffle ones,1
Great job!,1
I need to try this!!,1
we really need _Beer in Kansas!,1
ahhhh totally going to buy these. Fml,1
Where do you get the syrups?,1
#bravo #waytogo,1
Its simple....that Laphroaig shelf is just amazing and I want it,1
Omg these are to die for I need them in my life!!,1
@_SQUISHY_ I tried one of those tonight and it was BLECH,1
"Dont believe the hype, ive had much better rye especially at that price point!",1
Wow. Where were these?!,1
_and_alex we gotta get em before may 11th joe,1
Where do I find these!?,1
Bring back cita lol,1
I love this please can I be able to get of of this?,1
"Been a favorite of mine since i was 12, 10 years strong.",1
'all the Tic Tacs in the world will not fresh his breath after this' n- Colbert n,1
Gorgeous photo of you girl,1
Don't dis them until you've tried them!,1
Tic tac gum?! Sounds awesome I need to try!,1
well i guess they better lock him up forever then,1
That's a massive headache if I ever saw one! At least go me!,1
Damnit I want only because I have the other colors,1
Thanks! I'll check it out,1
__ i need one of them,1
Saturdaypic.twitter.com/JAsDI87g03,1
Thats litterly my best choco i cant lie,1
Yes please bring them back I even forgot they existed they were my favorite back in the days,1
Congratulations Spen dog love from,1
can we be friends again?,1
Several pairs picked up today. Tons of NMD's for sale as well. #NMDxr1 #AirJordan,1
Stunning chef! #realbread,1
I want doctor pepper but I don't really like the drink,1
_qu1ntan1lla I need mine already.,1
I love it! Great job Mona!!,1
"One step forward, two steps backwards I guess, Its a process!! We will get it one day!",1
Wow I tried to buy a dominos gift card with amazon but I can't,1
I wanna try this stout,1
need,1
Where the hell can I find this? I need it,1
but will they have toast there. This is important. (see ya there!),1
Ill have to try the chicken nuggets! We cant have nuts at our school...which is fine but its so hard to find food and I was so excited hed eat Lara Bars and then realized they have almonds,1
"Hey youre drinking my favorite pop, Im obsessing with DP",1
i want some,1
Sour gummies of some sort! And flamin hot Cheetos now I want junk food,1
"Rob eats 2 things. Vanilla ice cream, hamburgers, and drinks Pepsi.",1
Yes!! Snickers and Hershey with Almond are my fave.. but I get it people with nut and peanut allergies stick with these two.,1
i'll take all,1
"oh shit, I need these.",1
Wish Maryland had more of it,1
I need these to be real,1
let me know if you try it.,1
Save me one let be buy one lol,1
Omgg i want these too!!!,1
"This is a damn good cereal. Now if i can only find the thin mint and blueberry pancake cc, I'm gunna try target this weekend cause i can only find the keebler at stop and shop",1
pls post this in meal deal talk,1
I try to be.,1
#60giftsfor60days,1
FCK IT I LOVE RITZ CKRACKERS,1
it's the secret stuff!,1
Why did you tag AA?,1
Do you typically have a favorite??,1
Mamaroo and 4moms bath tub!,1
"This level of """"Sweet & Salty,""""...",1
"dude, I want this! Where did you find it!? Yeah I might be a addict",1
Sara!!! Lets get lunch or dinner soon!! I miss u & Ava!!,1
Ah yes. Ritz chicken is my specialty! I'm going to have to try it on the cast iron (I usually bake it),1
These sound perfect. I'm a great cook but terrible baker. Might have to try these though.,1
That BET tho,1
"Kelly Slater is awesome for doing this! Of course Jack, Kim and this foundation deserve it. Being an Environmental compliance coordinator I understand the foundation of this organization. It is well deserved! I wish you all much success and growth for the future!",1
You guys should try the hot skittles! They are in a black bag at woolies! I haven't tried them yet but I'm so curious,1
idk. but i kinda wanna try these,1
First like,1
I really wish Wendys would bring back the old fries they were waaaaaaaaay better!,1
I need them creamy jalapeno we dont have them here,1
Where is that at my dad will want one,1
#killashawgloves,1
Wish we had this brand in Canada! This birthday box looks delicious.,1
Ugh I need to get to a Godiva shop. It's been over a year since I've had delicious ice cream from there,1
I will definitely try to get to the place like this soon. Looks like a lot of fun,1
I need these in NY!!,1
I wish they would bring the coconut one back!,1
Time to find another liquor store,1
Yay!! So excited for you both and I knew it damn it congratulations,1
Please make a video baking these,1
I saw the commercial and was like that can't taste good lol. I'll give em a shot,1
Nice way to settle into the new pad,1
no idea lmao. I wanna try the milk tea one tho,1
The Moops invaded Spain in the 8th Century,1
"I keto alone, but my boyfriend and daughter support me 1000% I love bubbly too!! Wish I could get some of those flavors.",1
I Want it too ! Looks Great,1
_TED dang can I get a 2 liter,1
"she look so,so,so beautiful #MTVHottest Justin Bieber",1
"Ok, definitely buying these.",1
if i get them ill sell them for 1k to you,1
Only box k price bathA de,1
_v1sion these are the ones im looking for we got to find ! Lol,1
Ooh I wanna try this one!!,1
damn need these,1
fight me Bruh lol,1
Must try... i drink the lemon lime and add about 1/3 diet cranberry juice.,1
Now that looks good mmmmm,1
Kinda want some Sprite down my throat.,1
I was also brought to your page from Eelman case. I wish you best!,1
want to make yearly wages in months ? then have a look at my page and drop me a message !,1
Can't wait to open the #newhorizonmall near you! Will you come visit?,1
This looks awesome. Love the colors!,1
Yum I need to get some of this!,1
i must try,1
Chocolate covered Ritz crackers are amazing so Id definitely try chocolate club crackers lol,1
"its magical, you need to try it!",1
Well from now on Messi will keep scoring in bernabue. Cause we don't have the real king,1
will get one of these.,1
I want some chips please,1
All the smarties >:D,1
were gonna need that extra jug,1
if I can find them I will!!,1
BRING IT BACK!,1
_marie you're the one who called her a wee bag of Doritos. I believe that makes ... oh I don't know ... YOU to blame.,1
BRING BACK MUNCHIES ULTIMATE CHEDDAR SNACK MIX,1
I thiiiiink we should get these..,1
Yeaaaaaah. I need one of those later.,1
@_mdula4 pour me up,1
Rly Bad sry /$semicolon$,1
CHOCOLATEGIVEAWAY!,1
@_shannamarie I must try them all,1
and had the throw them in the back yard because we fucked them up,1
Raising Cane's is the best damn chicken place on earth and northern cali has exactly 0 of them. Makes me want to move,1
it was either Mr Toffee Design Company or NoPattern,1
_is_good I've been in my car for 40 minutes and I'm now on the on-ramp to the highway,1
"Oh dear..... RT xe2x80x9c: FYI, starting on Feb 2: pic.twitter.com/m6Grtgi64Xxe2x80x9d",1
Looks awesome,1
Yes! Where did you buy?,1
Seeing more of this beer.... Might need too try,1
those need brought back,1
Great Neck Diner! And second Mc Ds!,1
"_devo Challenge accepted, my friend. I got a hold of the Japanese Pringles and the Doritos Royal Beefsteak from Japan. Still have yet to get Lays from there but Im willing to give it the ol college try.",1
Im starting todayy!!!wish me luck im really nervous !like if you are too!,1
Can you send me these please??? I love M&Ms...,1
Need this,1
Let's do this vr46 forever,1
You guys look so cute!,1
OMG. Im going with you next time,1
Dude that looks ah-mazing!,1
we have to get one of these,1
Where do I buy?,1
brb renaming guild <Sprite Flavored Coke>,1
.twitter.com/ZKSqmUmPpY,1
_ comin for you bae,1
I love you dwayne,1
we need to grab these Sunday,1
NEXT /CauseEveryLevel ToHave VariableNotSame OnMy Interpret Art Psc/MyWill ToAnswerYourLevel(OK),1
Can I have some swedish fish please!!,1
Bring these back !!!,1
I must find these!!!,1
it's a small way of feeling closer to my OVEPG (guess the initialism!) Nostalgia thru calories!,1
so happy to try thes new gum,1
_DiAbLo now we talkin!pic.twitter.com/KxYe4Iy2aL,1
Check out my page if you enjoy Wine & Spirits,1
although it will not be one of thesepic.twitter.com/sqWv29wTzl,1
"I've seen it, but I have never had it.",1
It's #NationalDogDay! Show off your precious pooch by tweeting pics to #komonews!,1
Please share with me I need it right now!,1
I literally hate those,1
Lmao they were reviewing Oreos? This is what I mean by how most Atlanta teams do cringe worthy stuff.,1
I can't wait to do that next week,1
Omg. I can't wait to try these!,1
Give it to me.,1
Shes so cute!!!! I want that dress!!!,1
Beautiful,1
"I SEEN THIS DAMN TACO A MILLION TIMES IN THE LAST 24 HOURS, WE GETTING A TACO WHEN TRAFFIC DIE DOWN.",1
I'll buy it for you,1
wow that bottle is fab!,1
Since when is starbucks a fast food chain?,1
RAT,1
That is a great year! Id also go with pappy 15. One I have never been able to find.,1
"La, awesome account, check out ours!",1
Do you have them all mate,1
_96 very appropriate,1
where do we find it?,1
would love to win this! Will make some for,1
_Mason81 _Lash I'm so confused,1
hope this is in the uk cause I want it.,1
xe2x80x9c: 5SOS for a shoot! -Mnn #Vote5SOS #KCA #iHeartAwards #5SOSFAM #BestFanArmy pic.twitter.com/81tfwCH4lexe2x80x9d,1
LIEESSSSS BUT I NEED SOME THO,1
I want some bun bun since u didn't leave the strawberry for me,1
Pour coke on you and lick it off,1
Omg I forgot about these too. I used to devour these as a kid. Must find!,1
"Sharing is caring, nice lineup!",1
can we still do it,1
I've more spirits than Harold Meaker,1
"Love the wagon super cute setup, friend!!",1
scared the shit out of me when it exploded,1
That foil on the teeth took me back!!!!,1
"Looks good, where's that from?",1
dude I want these!,1
omw,1
Fluffy is gonna buy this 1!,1
Where did you find these?,1
Oh definitely the pizza hut cups!,1
NA,1
I saw these at Longo s today as well.,1
I want one,1
np!! where'd you get it??,1
clearly you're not flying with the cool kids.,1
"These sound interesting, bc I love to eat peanut butter sambal or sriracha sandwiches... So sounds like a good combo",1
somebody was definitely having a laugh,1
Brilliant isn't it,1
I want them.,1
They should give out an ESPY for xe2x80x9cBest Hops.xe2x80x9d #ESPYS,1
Where did you get that hat?,1
me too,1
_Clues,1
Love this overall!,1
"Haha! I will be in Japan while all this stuff is being sold!! Theyre also getting a bunch of new muffins, some apple iced teas, two new apple pies and some salad panini/wraps, according to their press release!",1
Give me all the Easter chocolate!,1
_tea01 I need these,1
I cracked open the Froot Loops as a celebratory breakie this morn It should be an awesome day out west where I am,1
do read this carefully! I want to add inches in height and not in the waste.,1
Fuck me upppp. Love this design,1
"Have it in kalkaska, northern michigan!",1
I need some more,1
I Want in mxico please,1
I'll take the big bottle of old grand dad.,1
"my real one has stiff in the name, so is still apt.pic.twitter.com/UYUrOQNx6y",1
Scott introduced me to Mitch hedburg! He was hilarious,1
"The 10yo is simply a classic. Not everyones choice, but a whisky everyone must try!",1
kinda want to try the kfc bowl,1
omg where do you get these???,1
I want to try them all,1
Need to try the cocktail sauce,1
WHERE CUZ I HEARD THEM MF SAY THEY WERE GONNA BRING IT BACK SOON,1
"Fuck, now I want one.",1
sounds interesting. i'll have to check that out.,1
_it_onn You need help,1
_Beer pic.twitter.com/3bpuUVwJt0,1
Where did you get that bottle??,1
so true I its a law married women should not EVER have to put gas in a vehicle I roll on fumes and before I do then the hubby complains and I'm like don't get mad at me caz you didn't get gas,1
It says 2 for 4 so I'll pick 2,1
_ THIS IS NOT REAL,1
I call it trash bc i dont see mountain dew baja blast,1
"sadly my pretzel was burnt and the cheese was almost frozen! But hey, it was still tasty!",1
Ill get this and the m&m almonds,1
I might try the flamin hot dill,1
Can I have one,1
Congrats! Hope youre all doing well,1
free tickets to the show at Food District tonight! Get them from 6-8!,1
Lets buy some Japanese chips if u want spicy !!,1
"i could,",1
Everything looks so delicious,1
I always get a double. It's only 2 bucks more !!,1
Well done. A great welcome!,1
Ahh i want me a bite of that,1
I had the good fortune to meet Maria Teresa along with Luigi Villoresi. Unbelievable inspiration both. #legends,1
Lovely moment captured here,1
I need,1
Omg. I need both.,1
i want pizza #PizzaHutHut,1
When is all star game,1
But you know I want some too,1
Wow that is unreal,1
Send me some,1
Missed out on the 125th. Awesome giveaway,1
Its not worth the headache anymore. Ill buy the occasional store pick but Ive mostly switched to scotch.,1
The Sega Saturn logo,1
I want chocolate covered rice,1
Dairy milk coins would be fine. It's the cheap ones I have an aversion to!!,1
just register on and pay,1
I have to try these,1
I need this,1
How do I order this??? I've looked on the etude house official IG page and can't find it??,1
Bring back the basement and the bogo pepsi lids,1
Where did you find this,1
Pls translate to the English,1
Aww this is so cute!!!,1
Amber said she wanna try too,1
What else did you have in your pocket?,1
Giving the gift of pre-diabeetus...,1
Great shot brohappy weekend,1
It is! I would say make a wish as they are good luck but you already have a Ferrari!,1
.was.here yes ur sister and I since u were lil.. I still get them!!!,1
Can't help but notice which one is on top .,1
Is this a new thing?,1
I had to put Nutella on mine.,1
Pretty sure you're the only one that likes the banana flavor.,1
Where can I purchase,1
I so gotta find these. I had a Reuben pizza once. It was pretty good,1
Wowwww. I want it!!!,1
I might try this,1
my partner absolutely loves the buttermilk chicken ones but our Tesco has them and has now stopped ! Is there any where else I can buy them from ? We live in a small town !,1
Goodness!! We want it all,1
I want some,1
Can I get a shot!?,1
For some odd reason I need that sour patch kid one,1
I have to say I have a soft spot for these,1
whered you find the small bag!?? I want the small one!,1
This better be in SA also,1
This is dope! Try the Cardi B chips next.,1
Did you get that on a ship? I saw the same package and it called to me.,1
Holy shit! I need this!,1
Can you buy that M10 for me and Ill Venmo you lol haha!! 150 is decent!!,1
_gonzalez I can't believe I'm missing his first birthday!! Sad face.,1
_aim_tyga ghetto Annabell.,1
buy this,1
.twitter.com/VZxDfRA5lV,1
Yay for baileys! I want all of these!,1
I'm going to try it,1
Are these in stores? I need these for the indy 500 and you can't bring glass in,1
Sierra Nevada Brut well worth a try,1
Probably afraid the inevitable shoot out at the Walmart Corral with their own weapons & ammo.,1
_schuldt sooo do we need lol,1
Avdols arm's are the kik kat,1
not a want but a need,1
I have to try these!,1
_ Have a so good dinner! :),1
still need to get that protein in,1
OMG I NEED THIS RIGHT NOW PLS!,1
Omgosh making want to go and get chocolates,1
One of my favorite beer,1
Always smooth...,1
Lovely as always,1
u need to buy me all this,1
Ahh i want these but not sold in stores. Only online,1
.m.west if I didnt have to go I would have easily got one with drogs on it!,1
We have a _racing t-shirt to win! Q- what is this make of vehicle we offer on our fleet? Also RT ends 12/09pic.twitter.com/0UtNU0z2HS,1
Can we come to your shop and buy it?,1
Rusanowski rules.,1
I wish they could bring it back!!,1
#killashawgloves,1
collab bro?,1
why dont they have these over here,1
I need pumpkin spice rolls like NaoW,1
Can you give me these I want to eat these right now,1
Where can I get these? The flavours sound soooo good,1
"When I first heard of Mr Dale Houston, helping people make weekly withdrawal, believing those stories was the most difficult thing for me as at that moment... To me, it was one of another porthole to rip me off my hard earn money. On till I gave him a try and it turned to be true, contact him now and testify _dale_houston1",1
Yum! Love that place!,1
could you guys please like my new post i need it and i only have 24 hours left to do it plsss,1
So so true and so so sad,1
Wow I need to try this,1
.dot.ray I need this,1
#BatmanApprovespic.twitter.com/DjFpG7Phtb,1
Where can it be found please ? In eu ?,1
"Choc Hazelnut & Gooey Caramel gosh, I want to try tim tams so bad!",1
"Caramel wafer and Tunnocks teacake...how very Scottish! Love it, I'll have mine with a big cuppa tea please. I live not far from the factory",1
These are so cute!,1
Must try many purely for scientific research,1
Beautiful shot,1
Thanks for saving us the time/ calories,1
Loce this wow so cute,1
Daaammn. Gotta find these!,1
Needs some type of cookie.,1
I get Impossible is making people think twice about meat but Id never eat anything thats not real food. Hoping people give up meat then realize theres a healthier way to eat and thats whole plants.,1
Ha! Ixe2x80x99ll forward this to . He could use some tips. :),1
Where can I get this,1
Wow nice collection,1
I want these in Panama and I can not find them as I can buy them from here?,1
We appreciate you coming to market to share your knowledge with us!,1
_ng u need to see this,1
Where is this from!!!!??????,1
This bottle got me in love with bourbon,1
@_daplug.daughter_ omg I wanna try these,1
How fun! Would love some chocolate right now,1
_BLURNT is it free?,1
Follow us.,1
#BEASTMODE,1
Where is this?,1
Happy birthday,1
Loving it,1
I need to get this,1
I'd like to have it.,1
Haha...I best buy some more!,1
Candy. 666. Candles and teas.,1
I need to go and get these soon.,1
Link to worksheet?,1
Where did you get those Coca-Cola bottles?!,1
I want one,1
Love their beers!,1
Want,1
wheein - mamamoo pic.twitter.com/cTj3KwUo1J,1
You already knooooooowww ima try it,1
this is terrifying,1
I NEED THIS _knightt,1
I need it omf,1
I'm so doing the Bourbon tour the next time I'm in KY!,1
I still get Star Crunches at the gas station and eat them before I get back to the car so my kids dont know,1
I want one,1
I'll take one of each...,1
I thought this was a sponsored Cheerio ad lol hes so perfect,1
Little Markie all cozy in that taco is cracking me up,1
_vidacheck NEED,1
Always wanted to try!,1
BRING THEM BACK,1
"Very interesting review, I am curious to try this gin for some time now. Maybe one day I will have the opportunity to get myself a bottle",1
_Yu how did we not know last night?!,1
definitely need it in England,1
The pumpkin spice Eggos look so good,1
Pfft it's not that far from the city! My team goes there a lot.,1
I voted for my favorite driver Dale Earnhardt Jr. hope he wins most popular driver. He definitely deserves it. Go #88,1
Keep warm & cosy! This is me!!!pic.twitter.com/ScUvQngZee,1
Yeah they look like me stumbling through a dark room looking for a light switch.,1
The Oreo one and the chocolate chip one,1
Wow I cant wait to try the Cranberry Sprite...yay,1
Where can I get this ?????,1
I don't approve of any,1
I've never had this but I think we should try it!,1
only one glass is worthy!pic.twitter.com/mT7fhqgCTc,1
"That was a first half worth celebrating. Cheers, Jamie! #WeAre12",1
We hope to make it up to you this weekend. -Cara,1
I need these,1
Omg what store did you find these at?! Ive been looking everywhere,1
Definitely trying this one!,1
i still have last years sitting at home. hoping to get to it soon.,1
we know you wouldn't want to spend money : ),1
Wow I'll be trying this. Guinness Blond,1
whaaaat no way I needs that,1
Lagavulin 16 my absolute favorite. Only get it on special occasions though. Buffalo Trace probably my favorite budget friendly bourbon. Though Ive been really enjoying American Born bourbon lately.,1
_knott Oh hell yes! I need to get some chocolate ASAP,1
I need these!!,1
yum look at all that chocolate!!!! Retweeted & Following,1
"Madeira, Port, Fino - in that order.",1
