_Shadow That is why I blocked him twice (this time for good a few weeks back) he has no maturity and no morals.,1
Omg yum why can't I have that here!!! It looks delicious,1
It's been nice knowing you!,1
Happy belated Birthday NatashaI hope you had a great day Cheers,1
I need this in my life haha,1
I was gonna try these next. Great minds,1
Omg man !!!! I have wanted that bottle for a long time !!!! awesome get my friend supremacy jealous,1
I fuckin need this right now mate,1
are you back!?? I need to drop those action figures off!,1
"Exciting! Im with you Tess, cant beat to look at it after its gone to print. By the time I do that last revision I have definitely had enough!",1
#OnePride,1
And they murder babies. Win win. Sexist Yorkies for the trifecta.,1
East Africa top Tweet this week: US Sanctions on Sudan donxe2x80x99t mean you canxe2x80x99t get a KFC,1
Modle our clothin squad!! Peep our insta bio soon afterward you read this,1
I really want to try this,1
"Don't worry, I already said to that'll I'll have to save you some Pop Tarts to try _28",1
You know yr chillen with Roy too much when you start drinking thesepic.twitter.com/ja36aEkpmO,1
we will have to look for them online!,1
Where can I find this,1
I want one of these so frickin bad I think itd be a perfect mod for adventures!,1
"Actually ,no. But I want",1
Haven never look so amazing to drink but I would just have a oz a day of one so it could last a life time,1
I NEED IT,1
thanks so much!! Will try to share the recipe next week,1
No thanks. Just dont want either of em. No trannie meat for me.,1
Three Cheers to Peat. Nice shot,1
So natural so beautiful,1
I won't have the car until jrs tags get here :( _chapa,1
I hope you get 9-11'd.,1
Great photo!,1
Where did u get these???,1
Chocolate brownie?!?!?! I want!!,1
I wish they made their cherry filled chocolate cakes all year.,1
Look so delicious,1
Need,1
Wooow I want it,1
I saw them at walmart,1
I have to try this still!! looks awesoommme,1
_bon get well soon!,1
Mannnn byeee them nasty,1
Yessss immediately thought of you when I saw it! Haha,1
For science.,1
This image is a great,1
Where can I find this?!!,1
he will look better in a reges jersey.,1
Give me all that ice cream. I would try those especially the Ben and Jerrys and nutty peanut better ice cream cones.,1
We need these in our lives!,1
You have to sit on an advertisement for Tecate? I think they're trying to send the message they don't want you there,1
email me your mailing address theimpulsivebuy.com,1
You're welcome Joanna! We hope you enjoy it!,1
.tothe.max omg I need the Bud Light one!!,1
Omg I want this,1
"Can you bring some to the west coast, please?!?!",1
"Apparently, more peeps like #cheetos than the kettle chips. Next time, I'll get the Lays Ruffles chips.",1
"it's all about jets and hungry howies. Then again, those are the local ones everyone loves around here.",1
"Um, how long as this been available for human consumption?",1
This sounds amazing! Love it,1
Lets get the pawty started,1
Fredrick Dacres #GuessTheAthlete,1
Are you going to return to UK??,1
where was that last night??? I needed one in a bad way.. #ChampionsWeek,1
Yoooooo those chips ahoy and the rice krispy treats soind mighty good right now,1
.karsen you definitely need this flavour,1
"still havent found these anywhere around Annapolis,MD",1
..... _mcgeary will be TITOs 19th win!!!!,1
first one !!!!!!!! I want it,1
I want a cherry coke please :p,1
I need that in my life,1
Very beautiful view,1
That's a pretty good one. Actually I think your recent photos are really good. I will be waiting for your next photo,1
I will thank you very much!,1
i'm going to burger king right now,1
I want to try them,1
Need to try all,1
"I still need to try this release! Slinte, Greg!",1
Beautiful picture ! Hope you had a Amazing trip with your Beautiful Family,1
waddup?,1
So gorgeous and what a great smile,1
how did they go?? :D you found out quick!,1
.,1
_reaume we need these,1
Is there any way to buy them somewhere?Those bad boys look stunning!!!,1
Wow! That's a lot of stuff! I'll be right there to help! I love Coco,1
PIDDDDD i want sum,1
Buying these today,1
facts my friend!!! I just Saul Jack-in-the-Box has a strawberry Dr Pepper. Not sure how I feel about it but Ive been dying to try it,1
Tryna help me try this,1
where did you get it??,1
The other UTZ chocs like pralines might be decent to other people but I would rather buy the cheaper Italian and Swiss choc pralines in wrappers,1
"Yep, same order for me. That 20yo is",1
I want,1
"So good, even birds want a bite",1
Were do u get them were u live becuz i live in the same city,1
hey!! Would love to have you as a glassy babe. send us a dm!,1
Estupendos,1
give me all the protein,1
Hope fully all supermarkets get them.,1
"Some of the options are vegan, this blog is to help people order vegan there! :)",1
"Gosh, finally a reason to get to BK!",1
HAHAHAH,1
Hahaha! Agreed!!!,1
yo u guys got any plans to get a TV Deal in Germany ???,1
_culp I want these!!!,1
me too!!! And I can confirm they are delicious! Im hopping they keep restocking these as I really need to try the almond ones next time!,1
Omg I need this! Can I order it on Friday when I get paid?,1
Omg I need to get the caramilk one ASAP,1
Save me some hot fries,1
.ward I need this.,1
Gotta say... the ASW Fiddler Holiday Single Barrel is an excellent Wheated Bourbon and we have plenty of it. Come check it out! Also... support your local Distillery!,1
This was such an amazing box!!!!,1
"me too, going there next year again for my 40th",1
@_sofysb_ omg I would totally get this,1
"reeses, heath, kit kat, milk duds, almond joy, whoppers",1
Yum. my favorite is Justins dark chocolate peanut butter cups!,1
Where do you find these idiots?,1
Wonderful Dear,1
I may hit the super target tonight. They're usually on top of the pumpkin coffee game.,1
"They look like they were frozen. Look how the middle looks soft and mushy, and the rim of the taco shell looks hard. I guess I'd have to try them to find out.",1
Can you bring over some skittles please thank you very much,1
and Baja Blast comes out on 4/20 fagit,1
I neeeed these in my life especially as i sit here starving. Sadly we dont have these here,1
Omg I love kit kats gotta to try asap,1
#OKState WR Jhajuan Seales' mother Twana is also braving the cold/rainy/soggy elements to be .twitter.com/HfJhc2LLaV,1
This gins local to us! Need to try it soon. Love that glass too!,1
__Briggs Love it!!!,1
yes lmao!!,1
Ill be testing in February and March. Cant wait,1
"mine is either 2 or 89, 2 because I carried that number playing Rugby union, 89 because being year I was born...",1
The world gets rid of more a leftist madman. Socialists likes egalitarian misery only for the people.,1
"That's awesome!! I just bought some yesterday, I wonder if your picture is on them?!",1
"Love it. Except selfie-man is empty. Otherwise, good picture. _EUS",1
also played in about 15 more games than Silva and Griezmann,1
yea but we were right there so we went for it,1
Which Keyfood location in the Bronx has these?????,1
Next on the ordering list! The notes you listed sold me,1
Wow - just wow! I EC and a little hallelujah ! Thanks for educating me along my journey ! I have to have this bottle no doubt !,1
Same here i heard a lot about the gyoza so i definrtly want to try,1
The prick in front of me is arguing the toss over what is and isn't included in the price of his meal. Fuck off mate I'm starving.,1
I need these in my life!,1
Ive only tried 4 roses once it was pretty good. This one seems to be special. Would love to try it. How about you ?,1
I would love one #FreeMugFriday,1
.kmata I need them!!!!,1
take a hand full,1
This is ratchet as hell but Im definitely trying,1
need to try this place,1
daaamn then I need to try it! I hardly ever get seasonals!,1
Omg the 3rd and 4th,1
I want some #pride Doritos,1
". All we can get in MS is the basic Toki and Yamazaki. BUT, thats only if I give someone the right favor. On a serious note dig the content. Dont stop!",1
You're all set! Have fun!,1
"When I was a kid, I wanted to be a firetruck",1
I want to send them to me,1
I so want that,1
counts if In-and-Out does,1
You may as well be. Your not his coach and as soon as Abramovich realises he's made a big mistake the better.,1
"Introducing (BGM)Spicy, Normal, Moldy, and Poisonous",1
"no way, i thought it was an instagram filter thing",1
"_W_Palmer _5 ps avi is nice, I like that",1
"Happy belly, happy anchor",1
"If you make it to Leeds , come & have a Sam Smiths stout",1
We want to travel the world with you. #Cheers,1
.jai gonna need these.,1
Now where can I find the maltesers ice cream,1
thats an amazing post,1
enjoy Jason!!,1
@_amalya_s HELL YEAH I WANT PIZZA,1
"I need $5,000 and an iced coffee",1
no real trees at my Walmart but living in Vermont it's pretty damn easy to get a real tree,1
They need to start making candy real again :/,1
Um I need this in my life!,1
Oh yum! Need to try this flavour,1
Wow very nice presentation cheers,1
Flamin' Hot Cheetos bagels now exist because all's right with the world -,1
"Have you been scammed by some fake trader? And youre contemplating if you still want to trade? Search no further,",1
#LOL n #grateful to ALL #VO - like all have fav folk to play w,1
Congrats to the winners woo,1
I'm nominating myself because it'll be the only bloody present I'll get!,1
well the media did portray them to be enemies but take away a team and you can see the respect,1
"Ive never tried that watermelon juice, but now I feel like I need it lol",1
Hahahaha great game! Strike!,1
Im addicted to the raspberry one.,1
So proud of you!,1
beautifullll !! 10/10,1
xe2x80x9c: The winner is... *drum roll please* thanks for the help y'all pic.twitter.com/TzVG7EnWpLxe2x80x9d was this good? I rlly wanna try it,1
want,1
Ooo I'll take that,1
this is news we don't mind hearing!,1
"Man, this picture contains all that is beautiful in Canada",1
I love a great cup of coffee,1
available in the states??,1
I need some of them,1
Man I need that now!,1
I need this funko,1
Here here. Just lovely!,1
Get well! Remember: speed saves riders,1
_ never had a gin martini but definitely going to give it a try!,1
Looks delicious!!,1
is this green tea flavored?,1
daddy,1
good to know. Ill have to try them. Its always funny trying to explain the JITB ones to people who havent had them and telling them its a slice of American cheese haha,1
Thank you man..,1
I'll take the Old Style and the Coors.,1
Wow I need these in the UK,1
Old Dominion was phenomenal...And so was #FlatKenney!pic.twitter.com/CZdzqVlnNe,1
Do you consider these healthy? If so I'm so stoked lol I love the Blueberry too. I'm going to try these next.,1
need it,1
I must try these!!,1
He loves other people and dogs because he rules. We canxe2x80x99t wait to have him share the cuddles!,1
I want to taste them,1
Wish they were in Australia!!!,1
Buy me these,1
Where did you find it !,1
I want that,1
Would be stoked to get a pair.,1
NORTH DAKOTA ON SOME GAY SHIT,1
have you got any left? Never got round to getting them,1
"Cross contamination is impossible to avoid so here I am, fiending for an impossible burger",1
Ill take that ec18,1
Late birthday gift??? Want want want pls,1
def. need them,1
_oldmate that's a good idea... might have to see if I can get a case myself.,1
"Pira, means fire in Greek I think. The creature reminded me of fire.",1
"Not like I don't gift things with love for you too Spencer, but you know",1
yeah lol,1
Fantastic! Id love to try Barterhouse. Amazing photo,1
I have to get some!,1
_Annn awh I fuckking love you as well,1
I learned to try anything once!,1
"Check out the booty builder machine on our Instagram ..... your gym could have this awesome machine too.... it replaces barbel hip thrust. Its much safer and works the glutes, hamstrings and core. Its great for girls and guys",1
Mmmmm!!! I want that chocolate krispy thing!!,1
Yum i love it so much,1
Ooooh where did you order all this from please?,1
21 shots against in a period is less than ideal.,1
I gotta find this lol,1
Are these only in the states..,1
You guyyyyyys! Were hoping its Perth youre heading for next so we dont have to keep coming to see you on the east coast!,1
Such a beautiful one,1
Can you please share some tips to great posts?,1
I would love to try these!!!,1
omg I so wanna try this,1
Im not really a peach lover but Id give it a try just to see,1
Why cant we get these in Australia,1
Love your tat!!!,1
Stoners have gotta love those.,1
Awww so lucky I so want those sour patch,1
Really good stuff buddy! Do you like that better than the toasted barrel rye??,1
Lets go. INO FOR LIFE!,1
lol. He bought a bag after you left,1
Oh goodness I need those,1
Now I want to eat,1
Omg I need to try,1
You can start making up to $10k every week by trading with,1
@_Deeant I've been hit.... give me a senzu bean,1
How can i get it? I've never seen this one before,1
guess it's time to lower my standards again. Swiping right,1
I really need to try it,1
Omfg such a cute little bunny,1
you are tweeting!!!!,1
Now that's a cake I'd love to have hummm I wonder if it tastes like a margarita,1
Those are my shoes,1
Awesome this would be a perfect present for my 30th birthday this year,1
omg all of these,1
Is there any way you could send me Ghirardelli chocolate drink? Been wanting to try that out but I don't think we have it here.,1
#killashawgloves,1
_Hell this is literally what full house is!!,1
I need these.,1
"Between the 8,9, or 4",1
Ill try it,1
_event could be publicising #HyPulJet Range Extended Vogue with Absolute ZERO emissions by having hydrogen on demand,1
"Cool gallery, if U love cooking check my one and let me know if U like it . C Ya !!!",1
Ohhhh man I wanna try these,1
Ugh thats horrible. The original treats are the best. Buying all i can!,1
This is a lovely giveaway.. I so wanna win Guys please see my efforts! I lost count of how many friends I tagged,1
Want these,1
"That looks like it would be the best jack'n coke mix, really need to get my hands on the jack rye",1
These r soooooo good . You cant eat just one,1
have loads of fun!,1
wait omg WHO IS THIS ?! And how did I not know about her ? Also I really want Doritos now,1
White chocolate mocha happening first!,1
Omg! I was just talking about these cans w Carrie on our first ep of,1
omg i tried these the other day too,1
oh you poor sod,1
OCP....nothing better. #FatDebra,1
Mmmmm yum! Can I have some pretty please?,1
no I need more food,1
The real question is...do you like it?,1
"Um, where can I get this?!!",1
Will try,1
"Hey, how does Andreas wear same kind of hat as JML and Miikka? I thought their ones were unique grr.....",1
Oh my gosh! I need to try these!,1
These were so good I remember they brought them out for Halloween time a couple years back .,1
M on dieting wanna have it,1
"Dope can design, would love to try this",1
stylish,1
I guess isn't interested... How about you #VolunteerFirefighters #NoBudgetpic.twitter.com/YHQbxgMYaZ,1
he looks so happy...,1
lets try these next time?,1
BRING EM BACK,1
wish you could have talked longer!,1
Question: where can I get chicken and waffles??!,1
Wanna try these! Love these games. Check my story out to vote for your favorite candy bars,1
Where can we get these in the PDX area? I've been searching high and low.,1
Ick.,1
Oh bro... but why the police bab you??nnDid they see you tweet about crack or sumn?,1
_m306 I want,1
I thought u were in Vegas?,1
"Dex, get those shredding jaws ready!",1
Rattlers at MEAC Media Day. #meacfb #ibackthemeac #seeyouinbraggpic.twitter.com/YkncmVNNLH,1
Where can u biy,1
you and me both Karen.........You and me both....,1
This looks yummy! I'll pick Raspberry - merin,1
where did you get those? o:,1
NEED to move to where those are sold,1
I need these In my life ASAP. Group online order?,1
Izzat lemon tea? Of it is I would like some.,1
Me too! Gotta get me some!,1
This was very tasty ! Need to go buy more,1
FeelsGoodMan,1
"I will try it. I may be weird but what I like is frozen raspberries, corn and green peas",1
"Whaaat! These sound awesome, defo gotta try them",1
Apparently i cant spell-salt and vinegar #Lays #12daysofflavor,1
Someone send me some of these !!,1
when does it end,1
Fried pickles and ranch >,1
"I just found them today, cant 2ait to try them and do a review!",1
seems like it is hard to find. Esp the 3 musketeers.,1
so delicius.....I hope to try it soon as possible,1
"so if MY property were stolen, it is not returned, it is destroyed?",1
I can take pics with cars too,1
Gingerbread,1
Its coming up to that time of year you start craving pumpkin again !!!,1
I need this!,1
sweetheart I said go to sleep dont make me come back in the comments again or Im gonna give you a really big spanking me and your milf of a mother have some BUSINESS to handle,1
Omg those bowls are so precious!!!!!,1
"spill it m8, what's ur order",1
_10 I look sober fuck you mean shit show??,1
pic.twitter.com/XDeMNLlw0v,1
"_Precious I really think someone is setting them up, how can they not have figured it out yet.",1
These were my absolute favorite candy ever. I wish I would have stocked up.,1
"this is very important. If you see these, I need them.",1
_grieves must try these!!,1
all of them. I need them all.,1
So We've failed 'Out for delivery' and reverted to 'Quality control'? _UKpic.twitter.com/conPwhTK3y,1
I think they're the same! Sold out everywhere :( nSo gutted :(,1
Love this rustic shot! Cool #BCFood,1
Yaaay!! I hope they have them at my store because I have a few coupons thats save $1.00 off,1
followstagram com is the best way to get likes and followers to your account,1
well he says he's coming anyway #ufcbitch,1
"I have a 1.75l bottle of that bourbon its smooth,Ill have to try this on repeat.",1
Top Gun knows I need to get my hands on one of these guys...,1
four roses is some good bourbon.,1
Mmm I need some it's so hot today!,1
the UNIVERSITY OF HOUSTON!!!,1
I love this stuff,1
I need,1
SORRY I'M SALTY I'M GONNA BE SITTING AT HOME ALONE TONIGHT..........,1
"Haha! thank you, would try that next time!",1
I want a Crystal Pepsi Perfect,1
Oh god i want that jajajaja,1
yea I don't get it either and now Mrs. Butterworths comes out with their version too. Like who the hell eats pancakes out of a cup - plus they don't even include syrup packets,1
People still eat that???? Ugh,1
So lovely. You are so beautiful.,1
"Mmmm, [smack], this surprise chicken-bacon ranch pizza is delicious! Did you send it to Southaven?",1
And the #Whopper would love to be in your stomach too! Hope youxe2x80x99re coming for a bite soon!,1
Where do you find all this stuff!!!,1
That looks like plastic,1
Where buy?,1
I want chocolate .tobes _jemma81 i might share,1
#PatriotsNation #Patriots,1
I can't even handle all this food on an empty stomach. I need all of it right now.,1
I'm addicted to these!,1
Still need to try a magnum bar!,1
Awww sobrang okay ng deal nato! Will try!,1
"Wow, I know now where is microphone )",1
"Ohhhh Ill have to take your rec and try it! I too am not really a PSL fan but if you like it, Im sure I will too!!",1
"We have those cookies here, they're so good!",1
Omg that is a piece of heaven right there! Where can we get the ice cream?,1
"No, thank you! The Revelator is on the way.",1
KIT KATS AND KINDER OH MY GOD!! I need this box,1
you are making me hungry and I sooooo want those!,1
The dream drink! As advertised by KISS lol,1
"I haven't either! I'm a fantasy nerd, though.",1
I really wanna try the original flavor but Im broke so imma ask for it for my birthday,1
Looks amazing! Will give them a try........purely for research purposes,1
". You could probably make it stick if you made it the pic for a *new* Wiki entry called ""Amurca""",1
certainly not craft though,1
Happy Halloween,1
Want,1
NEED,1
bring me one please.,1
"_angelwings Super Metroid is so highly polished. It nails all the things it sets out to do, and it kinda defined a genre.",1
i want,1
_opinionpic.twitter.com/bnPIPPhm6t,1
wow that looks like heaven I need to try it before it leaves,1
So happy I met you! Sorry I didnt get to spend more time with you! Youre amazing! :),1
Ha ha wow!! This looks awesome,1
Where can i order this from ?,1
Sooooooooooo,1
CocaCola. I want lol,1
Where can I get this,1
I MUST TRY THIS,1
@_loveKelly Imma have to check with my local chick Fil a lol I don't believe it,1
#tennesseewhiskey # Just a few hours from where I live. #,1
I want it all!,1
I want,1
Oooooo im going to have to try these!,1
Well be there tomorrow to Wednesday....coming to find ya!,1
"Omg I have to admit I would be so down to try that haha, looks so yummyyy .carrier",1
Ahoy! Good luck not eating the whole pack in one go!,1
Where can I get a lawn ornament like that?,1
Wish I could have a GIN LOL. I will as soon as this bubba is out looks amazing!,1
Where did you find that Evan Williams red label?,1
Dr. Teal's!! I always need to have it on hand.,1
Those look super yummy!!,1
"Right no question, but I havent tried the old carter",1
I want to so bad,1
I've never had a vegan crumpet but I think I might have to now,1
missing a Mt. Dew solefam,1
Dont ask for options.. I want both,1
I want them so much,1
I love my Donalds,1
Never seen that before! I want to try it!,1
Now get over here and kiss me.,1
Keep seeing it but STILL NEED TO TRY IT,1
try this with me,1
I'm tryna get like you,1
Where can I get the gingerbread one?,1
Go get it!,1
"The biscuits people eat in England around Christmas are the ones that they get given. It's a cheap gift, people don't buy shortbread for themselves. Do you get locally made packets of biscuits that people give as gifts?",1
Where did you find it?,1
Trick question I want both,1
_ I want asteroids so much :(,1
Gotta be fake. No way is this real,1
_6SJS _YM_hstar i know its too late but thanks for the gift sungjae!i like it somuch chinguya!,1
xe2x80x9c: : Scent of Bourbon is in the air with our repurposed Maker's Mark Candles!npic.twitter.com/mqNHMZ9C8Yxe2x80x9d I want one!!!,1
_myers I need these,1
I need to try these!,1
I don't know anyone still eating their poison,1
Like when I need this in my life right now!,1
Good choice of barley soda my friend,1
Im dying to get an OBSK. I have an OESK and want to compare.,1
tunas #yasearmo,1
Love that the Bookers Rye is actually at secondary value,1
5th,1
Whataburger. No question.,1
They look yummy! Good job! Now can I have some LOL...,1
This sounds absolutely great!,1
"I will have to try, thanks!",1
I'll take ALL for the win,1
Nice sweater though.,1
gr9,1
I'd love a blakkr can,1
This is hilarious!,1
"yeah, just a clean and solid beer.",1
save me some,1
"Have yet to get my hands on an OESV, hope you enjoy it!",1
I need this in my life,1
"Just signed the petition!!!! Thank you , Vani and",1
.tipplers I need to try it,1
_TINpic.twitter.com/Olao1Q3N7p,1
I must try these!!,1
Lmao you Stoopid if you think tx likes innout,1
need to try this one,1
I want the flaming hot ones but I doubt I'll find them,1
THIS IS SO DAMN GOOD,1
Definitely want those sour wildberry ones!!!,1
Omg need this now,1
Yesss I love your snap chat!,1
I really like to have these when I'm on-the-go!,1
lets try this?,1
Perfect!! Havent had a coke in years!,1
"Today would have been Professor Sid Watkins' 87th Birthday. Much love, respect and gratitude. #F1pic.twitter.com/PuArwfhDKv",1
I want a beer. But I don't know why.,1
One of my favourites. Cheers,1
Send some my way!,1
Sounds tasty! Need to try it,1
Went for a run without u and now ur baking without me,1
"Woohoo!! Glad to hear the positive review, will be picking these up as soon as I spot them!!",1
tic tac gum? I GOTTA TRY THIS,1
This is a lovely dram,1
Dream comes true hahha,1
Save some for me!!!!,1
Have you seen,1
_josh I just tried again and they finally texted the code to me,1
Is it even good? ?,1
Now lemme get a Dorito version.,1
Finna run some Aaronspic.twitter.com/S1HrInukbc,1
"I am going to start stopping by """"the Davis bar"""" on the way home from work everyday if you keep this up! Yum",1
Oh yum where from?? Ive been searching for the bar aswell but cant find them xx,1
"That looks like a celebration, love the mood you set",1
"The labeling is definitely growing on me, still excited to try it",1
Omg this looks delicious,1
_ omg id actually try these,1
"hey...congrats on a good run at PIR, BTW.",1
I'll get some Snickers,1
looks like a good lineup,1
Thats my favourite chocolate bar will have to nip to _stores soon xxx,1
Wow this sounds like an amazing product,1
"Every one checking out the sick trick, meanwhile I'm more interested in the fact the Coke is """"Vanilla float"""" flavored. Like, excuse me... Where do I get this flavor?!",1
"Yes! First, get naked in your shower/tub to cover everywhere with sunscreen! Then get dressed. My fave is green tea buzz (which says tastes like grass, but he's wrong!) or naked flavor Tailwind, orange is okay too. I don't like fruity flavors. And try Lara bars. They're so tasty and satisfying. They won't crumble either. Salt for the win!!!",1
Hard work is gonna pay off,1
"I need to get a hold of Dunkaroos, plse help!!! They are still produced in Canada, right?",1
Looks so good I want three too,1
_dave I've never had either. I'll wait for your report,1
need to try this you popcorn addict,1
need to try,1
