The first thing that comes to mind when I think oh club cool is the sticky floors. I always enjoyed trying the different the flavors from around the world.,1
Good morning I love those delicious Have a great day & wonderful weekend,1
"damnit, none of those in AZ. I might have to Amazon these",1
we need these!!,1
get this tonight!!,1
Wore shirt on right ALL the time in junior high (1970's)...memories!,1
I must have these!,1
I want them Gucci chips,1
Where can I get these?,1
Wow watermelon lemonade? All on it,1
I want to try tgis,1
"Where do you buy them? I have seen the plain ones in world market, but nothing else anywhere in the US",1
I want them all im the biggest choc lover,1
gamauu nanti ga di kasih makanan permen ice cream yupi dan kawan kawan,1
ur the sweetestncan you tell me how much they would be?,1
And butter finger,1
Yooo the one in the middle Looks so damn smooth!!,1
In case I am out of network later a shout out to _P_Randall __Kil & back of the pack,1
:(,1
I need the New Riff mini. I grabbed a couple of the Four Roses when I saw them in Myrtle Beach,1
Tried it... too sweet,1
_AMC ammo. Lots of ammo.,1
Great shot Kate :) #foodie #friends #osakasushi,1
Thats a dream dram I need to find a bottle somewhere! It can only be a happy birthday with that. Slainte,1
Oh yummy! Give me all the chocolate!,1
I know I'm looking forward to it xx,1
"I did our 'big shop' in Asda last night & totally forgot to look for these! #fail I wasn't overly excited by the prospect, but you've sold them to me, lol!",1
I need subway....,1
RT : Need some motivation to get through the week? Retweet to #win! T&Cs:,1
_marie Whaaaaat?!? Need now!!!!!!!!!,1
Oya get me a stout,1
_ _ just take the L like cody did,1
How can I get one of those!?,1
First off I want some and I dont care for ice cream,1
Great shot and nice little review... Never tried a Canadian Whiskey.. I must start branching out..,1
Woowww Fabulous picture,1
need,1
Yes I need that,1
This us so cool,1
Is it available in Arizona,1
_Antoinette you mean the silence,1
Have you tried it yet? Keep some for me,1
Where did you find these??,1
I'm down but I doubt I'll make it brotha I work at a bar and get out late on Friday,1
broooooo!!!!! I want this,1
"Bought these to try at work, the whole office staff LOVED them...",1
I'll definitely have to put these on the list! Lots of recommendations!! Thanks,1
Been looking for this still havent found,1
can't say I do. I'll look in fridge at work and see what I can find,1
"@_MissTea2_ yayy, I'll be there...ya know, wherever there is",1
pabst extra light? what's left in the can?,1
#killashawgloves,1
Need,1
"Wonder what the sour patch kids are thinking when u bite off their different colored body parts. Like oh, I didnt need that anyway",1
The last one touched my soul tho!!!,1
"i ate them all, they were bomb as hell.",1
I wish I can eat them right now,1
_usa I give in! I'm going to buy those green tea Kit Kats today :),1
Make the holes a little wider and you may not need to take the entire lid off to take bottles in and out.,1
Um... nachos? Well i guess its nachos,1
I tried milka tender break and liked it so interested in this tooseems nice!,1
Please bring them to SA,1
That looks so good I want it!,1
for me just now I would said Turkey. Your words are very kind. I like to do something different. Yes it might not get the likes or views but it's easy to forget. The companies who make these sweets and snacks deserve some recognition for there efforts.,1
I want some what to give them at cici,1
".sandra.v a most def ,we both needa get one !",1
could've had Randall's smh,1
#growth #girlswhoworkout #healthylifestyle #mentalgrowth #healthyishappy #trusttheprocess #motivation #bodypositivity #fibromyalgia #autoimmunedisease #ibs #happy #girlswholift #food #lifestyle #goals #healthylifehappylife #togetherwerise #progress #strongisbeautiful #workhardplayhard #spoonie #nutrition #confidence #selflove #healthystudent #healthiswealth #nutrition #fitness #haagendazs,1
One of the coolest thing I have ever done! Thanks for letting me part of this!,1
we need to find these,1
How about something different?,1
pls bring me some,1
Beautiful pic.... Have a great weekend Karin....,1
Omg love love love and totally want food now thanks,1
Nice pic if you want follow my profile,1
This stack looks insane I want,1
lol I'd try it,1
.fx also id want to eat the whole bag,1
Big shed golden stout time. Or omnipollo do some amazing looking stouts unfortunately they are hard to get in oz,1
Are those poptarts at any walmart,1
Where did you find them??,1
Cute shot and sounds like a great event.,1
"Not sure, never had either.",1
They need to bring back the multigrain sour cream and onion chips back,1
What's that Chinese alcohol? Bring us a bottle!! what say .ds,1
maybe another ocassion c; pshh. nigga i can hang,1
Is that even real? I HAVE TO TRIE!!,1
hey Norman Im 44 today send some cake over to Brooklyn lol,1
I cant wait to tell my mom!!! I hope I can get some chips!,1
"Nice how is he doing, hadn't seen or heard about him in several years,I should do a better job myself keeping up with family,I love your posts keeps me up dated on part of the family anyway lolol, love you guys, peace",1
_pop_collector you should be able to find them in most liquor stores.,1
I want the Schlitz please,1
Wow. How much is this ?,1
Damn I need to try this,1
off the list last week! We shall return!,1
Chocolate bar!,1
Great shot!,1
Cheese is love,1
Where is the vanilla gome to it wss also one of the best,1
Oh .uk let's have these in the UK! Pretty please?,1
Just Got Skinny & We don't know how to feel about it. #DivaLife,1
Best chocolates,1
Hey! Nice gallery you have I mean I liked it,1
oh my. I must hunt them down.,1
This makes me want to eat rice crispy treats and go to the beach n surf,1
I NEED to get me some of those chips,1
_cazo Whats the point of having an impossible microwaved ? I want it grrrrrrilled !!! on a separate equipment,1
@_Christinaa__ thank you,1
_sweet_essentials just buy me one java chips when you win,1
NA,1
Sure we will.,1
I WANT ONE! can i put one on hold,1
"We've never tried them, will check it out.",1
I love beignets. I love freedia! Def going buy,1
Omg how I miss them... yes chocolate here sucks,1
It looks so good,1
Will have to grab this if we see it!,1
Nutty bars!,1
Nauseatingpic.twitter.com/Nua9zTeZs3,1
"lol no that would be ""going too far"" hahaha",1
Thanks for the share! I've been recently facinated with cooking with or for . I'll have to check it out.,1
Don't know what to think about that one . I've had starbucks cake pops before and they were good.,1
No. Just triggered my overwhelming fear of death.,1
Get me some of those Tony Stark's cheeseburgers,1
xe2x80x9c: ICMYI: Red Velvet Oreos are coming Photo: pic.twitter.com/7pU5rTp7noxe2x80x9d NEED,1
"Love it, mines almost gone, need more",1
Wow ! I need to buy some stocks.,1
I think I've only had one Dogfish beer. I liked it and i hope i get to try more.,1
My partner of nearly 10 years doesn't read. He loves games. I love books. We respect what the other enjoys and try to be at least interested :),1
Hi gorgeous! Looks good!,1
I NEED THIS!,1
Yumm need to find these,1
I've been trying to find the pumpkin one but can't find it at all :(,1
All!!! Where do you get them?,1
Cannot wait to get my hands on this! Love 4,1
Its about time! I can't wait to try this!,1
sikkkkke I'll be expecting this for my bday k thank you,1
Has a winner been picked for the square bar giveaway yet? :),1
_press Mind if we ask you to follow us? You can enter your birthday and make us all happy (and legal) #BlueMoon lovers. Cheers.,1
_austin probably for Pat more than you haha but Im going to try to find these!!,1
I'll need 100 of these,1
Hmm. Now I wanna go get one of these.,1
Damn !!! Bring to South Africa!!!!!!!,1
text me tomorrow we'll make plans for the weekend or something when we're both off.,1
On my list to get!,1
"I ask myself that fact that they are older how upset can you get. Obviously they are wrong and ignorant, but they come from a time when this was accepted. In some ways we all stuck in a time warp where change is hard to grasp and or accept. But yeah they are both dicks.",1
Cheers! I just opened a can for an afternoon treat!,1
Omg can i have one lol,1
_Shed me too fam me too,1
fuck a dozen roses I want a dozen donuts,1
So pretty cant wait to try it!,1
I'd buy it if you could ship to Australia . Love this,1
My favorite is the peanut butter pie ones .i still want to try the smore ones .How about a chocolate chip cookie dough one or fudge brownie cream,1
Its very tasty. At retail its a good buy,1
"He's going to the American Pie thing, isn't he?",1
This will be my new addiction! I'm dying to be released!,1
Get @ my recent?,1
where's andrew?,1
___ it does! I bet it'll be in stores by the end of this year. btw Stephen Colbert's ice cream was alright.,1
Mmmhmmm. I'll be there,1
.twitter.com/SK2sdsnc6s,1
I have to try some more of them love the peated scotches... has their quarter cask as well as the 10yr,1
Single Cask?!?! Good sweet Baby Jesus where do I get those?!?!,1
ordered on Sunday arrived on Wednesday mate,1
_navarro I want to go!!,1
Omg all look so good I want to try them,1
_d where do you get this stuff from,1
me. We are watched the series. Can't wait for tonight!!,1
When will they be on the shelves at Walmart in burleson tx,1
My kids love the social aspect of it - even think they love the idea of candy but never eats it - just keeps it in their rooms till I trough it out a week or two later - I brought them up too healthy.... I cut up pieces of watermelon (its hot where we live) and the treaters love it. I just cant get myself to hand out crap x,1
"They are all good just different for different moods the key is having them on the shelf is not the goal, you have to drink them so kudos for that!",1
"I did not know that you could get coffee there... and now that I do, it is definitely on my list for my trip in two weeks!!",1
I cant. I wouldnt have any self control and would end up buying it all the time.,1
xd0x92 xd0xbcxd0xb5xd1x87xd0xb0xd1x82xd0xb0xd1x85 xd0xbfxd0xbexd0xbfxd0xb0xd1x81xd1x82xd1x8c xd0xbdxd0xb0 xd0xb3xd0xbexd0xbdxd0xbaxd1x83,1
Where can I get a Welsh one??,1
_wilson5 I want to try this,1
OMG what a cutie!! My little guy loves those,1
no job tommorow?,1
I want this so bad right now!,1
Dear god. Need to find these,1
Want them all,1
i would have never heard of them if it wasnt for you! Making a purchase right now thank you!!,1
Look at all of those gorgeous super meowdels !!!,1
I may need these,1
where can I find these,1
"what the hell, no, just. NO.",1
I'd love to hear some tips on great posts!,1
need to try,1
This picture is great. Come to my IG and tell me your opinion.,1
my favorite candy ever!,1
I'll try it out next time!,1
_millray I need to find this and try both,1
man you bought the good stuff!,1
But food jus adds to the cuteness u feel,1
"These look so good, might have to try this weekend",1
"xe2x80x9c: What do you know about that #combo pic.twitter.com/d6Sw6hFXkKxe2x80x9dnnHonestly, just childish",1
It's def beer o clock here !!! Need this,1
That stuff is the bomb!!!!,1
can get a little samey,1
they're not lying tbh,1
Where can I get one of these?,1
these are a must try!!,1
They got the punk'n !!! Hell yea,1
Ronda Rousey believes she could beat every male UFC Bantamweight fighter,1
Its about time.,1
@__project.x_ I need this in my life!,1
Burger King is really shit don't,1
Hot damn! You really cleaned up at this mechanics shop! I once explored an abandoned house where an old fisherman had lived and he had utilized 60s pop cans as floats for one of his fishing nets. Managed to pull a good 20 cans from that net but they of course had all had holes poked in them,1
i want to try them,1
welcome to the team mate hope you do well with the team.,1
#cool #nofilter #whiskylovers #scotch #rye #bourbon #whisky #whiskey #fashion #style #motivation #views #cigar #happy #love #lifestyle #business #gentleman #mood #instagood #beautiful #classy #whiskyporn #whiskeyporn #cigarporn,1
Want them all,1
Where did you get this?,1
You are the perfect moment,1
"Cant get it here in Norway, can you send me one?",1
Definitely trying this,1
The reviews sound decent though. Might have to track some down.,1
Wow that is awesome! Id def try it,1
what a weenie,1
"_Durante And what is he selling? Oh, never mind.",1
I want to try!,1
Waaant can you get it for carryout ?,1
Your such a fun mom!!,1
lmk if your around my are I'll get it done. I'm by i10 and uvalde rd.,1
this made me go and buy,1
_ needs your support and i need a bottle to add to my mini bar,1
Nevermind those favorites. I'm building a case.,1
lmao last time I was in Club Cool there was a little kid telling everyone to try Beverly bc it was so delicious I was like youre 7 you cant trick me.,1
I need,1
Wow girls this are so beautiful,1
"I hope these are on the shelf forever. F this place. Give me some $65 Elijah Craig BP any day of the week. Or hell, some $42 Four Roses single barrel.",1
"you're talking about the driver code, but you killed it with the Kenseth penalty....don't promote it if you forbid it.",1
this car is a piece of crap my look nice but that's about it,1
I said the same thing about the '88 wc,1
What do you suggest for people that cant find these at retail? Settle for something else or keep hunting? Im genuinely curious Im not supporting the secondary at all fyi,1
_Verse0 DAMN SON!,1
we are waiting,1
Yum - Id love to try that almond one,1
thanks katie,1
Im only 24. Yall gotta relax we still young,1
Can't wait to try this,1
find me these and I'll love you forever,1
Why have I never seen these before? I need these in my life!,1
That's a killa drink indeed!,1
__K see u @ prom,1
Cant get enough of M&Ms!,1
"Hold on... Chocolate protein monster? I like the taste of monster, but I don't know how I'd like this... Hm...",1
"LOL, good luck! :)",1
"oh I just remembered as well, I've seen people keep their watercolours in them. I'll find you a couple of shots, I've seen some cool ones",1
Great style,1
This looks fantastic!,1
Where where where,1
Awesome! I need to get my hands on a bottle.,1
No comment bro real shit lol,1
coconut rough needs to be available here in the UK!!!,1
_FILT I wanna come,1
let's hope we see him in store then,1
Ive only had Burger King ans McDonalds fries cuz sweden got nothing,1
I'm not a beer drinker but Coors light is my choice for a light beer I should try chilling the Harmony,1
I only want the mint milanos.,1
Seriously.. Are you drinking those ?,1
Beautiful! But suddenly I want an ice cold Coke. Not sure why. Shrugs.,1
omg can we pls try to find the bagel ones !!!,1
Im the best pls give all to me,1
You funny mom,1
"One!?! Wuff would get at least 3! *chuckles*nVrghr had to order his online, and no stores stock those here. Euro-only?",1
what the fuck is this shit?,1
So lucky! I want some and I miss yall,1
I recall a post earlier this week,1
Well _to_kill next week I'll have them in camp. For now I'll just go to the gas station and get them,1
A thing of beauty,1
Better not be an April fool because I would actually buy these,1
download the app and u get free shit every Tuesday,1
Shes so beautiful,1
_Aspden fantastic room fantastic collection m8 very jealous indeed m8,1
Omg how awesome of them! And Swedish fish too!! Ive been wanting to try their products for a while,1
I could use one of those. It would p tidy across my chest and over my shoulders and covering my abdomen.,1
Love in it,1
aww I want some Altoids.,1
oh I just realised I started the design too high and I fucked up,1
Waiting for it to hit Europe,1
The middle two......Enjoy....,1
Car looks dope! _sergey,1
Have a fab half term. We'll have to try these x,1
Need to give them a try! Love you Maddie and Elijah!,1
Ummm yes please! Yum!!,1
I would TOTALLY try this flavor,1
Now I have to try these because I avoided the others,1
Excited to give this one a listen!,1
_Trucks Are you happy Kyle? You going to talk to the media today?,1
Can you send me some please,1
_dawn_ I want it,1
"It's me, Katcontii!!!!",1
everyone is in ac this weekend!!!!,1
I'd Buy You These,1
". In other words, Congress is useless to the American people. We need one that will stand up to big business.",1
I'll be at your brewery for a tour a week from today. Can't wait to try it.,1
The cutest girlies,1
Would be nice if they came back ahah,1
Smart! A bit of spice with some ranch to tame it down. Cant wait to try it!!,1
I want this,1
send me some . Though idk what you making,1
we need to eat this next time!!,1
I have 5 brand new 90s Tropicana spell our hats to go along with these jackets,1
I Must try this,1
I damn sure almost ordered pizza but someone made a food run. I wasnt doing anything else!,1
Where do you get these straws from,1
I need one... ok I lied give me a dozen of those,1
I'll pass on all of them,1
We think you'd love our shop! Check it out www.ladyduke.com,1
what.... i need this lol,1
"Hi Kevin, the Test Jersey will be in stores from the end of the month - home and away at Sportsman's Warehouse and XTrainer",1
Hue X Solz || White Hue Oversized T Shirt nn ONLY YOU GOT THE KEYS pic.twitter.com/3RErRaiE1f,1
We need more inside in this picture please. Who is Fluffy? Hahaha,1
This makes me want to leave my house and go find it wherever it is like the little #foodie l am,1
I too have one....in my bathroom,1
I definitely need to get these!,1
oh yes I understand which you mean!! It will be the next that I would try!!,1
Coincidence? We think not. DM us so we can chat.,1
"I have heard those are good, I need to try one!",1
I finally finished this show and now I need this,1
I Will buy,1
Oh my god I want this drink!,1
I went and got it :3,1
"Can you blame him? the club injected something into them and then denied they did anything wrong, now a 12 month suspension",1
shoulder to head is still an illegal hit and Vis was upright,1
Been practicing I see lol.,1
God I wish I could get my hands on an ETL so easily,1
I freakin LOVE this one,1
I Gotta Get Some Of Them Shits B,1
Yes!! Thyca.org!! We can eat a few more things. Still have to worry about the other stuff (like dairy!) that we can't eat that's in just about everything also.,1
Now I really want to see those teethes your so cute,1
what if they are good at both? You just dont want to listen to their political belief because its not yours,1
Dream come true! Where to find???,1
Need to get my hands on some of that!,1
I'm so glad I'm not the one playing that....XD Good luck dude,1
need to get these xx,1
Ill try,1
I need to try those ice creams!,1
Whew! So much scrolling.,1
I want all the burgers,1
"Love Dr. Pepper! Love this idea, too!",1
classy prize,1
Considered offering blank pre-cut tins?,1
"Yeah cuz he is bringing out the Patriotism in the True Americans. Now if it said ""Trumpweiser"" or ""Donweiser""...",1
This is making me so hungry.lol,1
"Classes went well! It was nice having you drop by The Clippers newsroom as well! Was dropped from my classes at the end of day surprisingly, hopefully fixed tomorrow as my classes are amazing this quarter",1
I want this NOW!!!,1
I dream of have one of these someday!!! You're an absolute legend!!!!,1
Sooo pretty . Good morning Happy 4th of July dear,1
OMG I hope target has these. I'm going to find the smores fiber one bars taaadayyyy.,1
diet dewpic.twitter.com/JPEiO7r6Fi,1
Those fries and wings are giving me life,1
hi!! What part of town?,1
"I want that veneno.... Just wondering, you have any of the old nissan skylines? (Not the R34) also any mustangs?",1
You are a absolutely beautiful looking woman and omg you have a beautiful smile,1
book it Pizza Hut,1
I need some tonight,1
I need to get some of these!,1
#9am #waytostartthebestdayever,1
That makes me want to barf lol,1
Bring it back!,1
I want to try the mac and bacon combo,1
I hope you laughed *blink blink*,1
Im in! Bring summer back with this yumminess! #bettershaken,1
_nicoletah @_obie1 I want this. But only because its pretty it sounds like it would taste bad though.,1
What starsky location you find these at?,1
Looks amazing would love to have some right now,1
Wow-thats incredible! I need all of it!!,1
he's asleep isn't he?!,1
need it all,1
Neurologically affected Nancy stammers and stutters through every interview. Dementia is definitely setting in.,1
IF YOU EAT BLUE CHEESE BLOCK ME LIKE RIGHT NOW LIKE RN. THIS WAS MADE BY THE DEVIL FOR THE DEVILpic.twitter.com/9oTrVAkrDz,1
"It was a pleasure to watch all of you, boys! Great event! Great tennis players and big hearts :-)",1
Seductive name of the bar,1
Thats the way to beat this heat!,1
_Iceman_ Hell yeah. They never dissapoint.,1
#findyourbeachpic.twitter.com/sw1ZrGDnnl,1
and also consumed I hope :),1
I hadnt thought about lemonade for Christmas I love it. It is being served at my Christmas party!,1
I have a sinus infection now so I probably won't open one till next bottle share,1
so ugly,1
Great shot of,1
I wish I could find some down here.,1
Yea I like the cinnamon too,1
Girlllll ill take one of those too! Lol,1
Oh dear lord I need to have this,1
So good! Need it!,1
You have to show the plate when it is cooked,1
@_itsdanika I'LL TAKE YOU SOME!,1
Salty ass superheroes right there.,1
right! Gotta get on!,1
#killashawgloves,1
BEAR NAKED too?! This is sold in the organic section so I thought it was ok,1
_Witches im on my way,1
Love this one,1
@_elissawilliams so we should definitely go get one,1
Do you ever try bakery cookies? People seem to think they are decent,1
I need,1
I love it all! Yum!,1
"Darn it! I wish I would Gabe found your site sooner. I can't find the fruity pebble oreos ANYWHERE. Oh well, following now!",1
hi can you go to Kroger and get me a banana taffy and cotton candy PLEASE,1
Just had one last night,1
That is perfect. I need to try this one myself.,1
I need this we don't have it here,1
how we supposed to get two pairs then,1
omg no I need to try them!,1
lambs are so delicious . Weve expanded our flock now. Cant wait till late fall for some of my own grass fed lambs,1
lmao nah. I just like the sauce,1
I need this,1
Tattoo there logo on you thats a partnership,1
Very well deserved !,1
Berro no la he visto jams. I'll try...,1
I need these in my life,1
Im actually semi- interested to try one! _711,1
Would love to know what you think of our kids range? Come check us out! Link in our bio,1
link?,1
Hmm...I'm thinking that I'll have to give those a try.,1
Pleaseee tell me there is a Bud Light coming?? I need it!!,1
First prob the onion ring but I'd try all of them regardless,1
waaaanttt!!! every.single.kitto.katsu!!! give me all 350 flavours!,1
There are always two people in every picture: the photographer and the viewer. ~Ansel Adams; Love the picture!,1
I tried these today. Not a fan. Its not curry but the coconut flavor it has is leaning towards curry flavor. So it confused me a little bit. I have a pack of the jalapeno ones to try tomorrow. I hope the toffee ones stay,1
"yes, but where is the word ""Easter""? The public demands an answer to this most important question.",1
I missed the memo on why to be upset at this commercial,1
i literally need to get this,1
very good feelings!!!,1
"buy then regular one, thenxe2x80xa6pic.twitter.com/SkNKmHaUHe",1
3 cus 1 fr it's a toy u can get,1
*hides* no.nnnoooooooo not candy don't make me want it,1
"I'm buying a bag! This is dope, congrats!",1
Want to taste them!,1
KYLE BUSCH!!!!,1
Cream and onion..,1
say whaaaat,1
Cheers babe x,1
I want one,1
I look for this miniature in Brazil and I never find,1
Need Welsh one,1
Can't wait to see people #rocking one of their #StupidHot #stickers on one of these.,1
I need this so so badly if you ever see it,1
Bye bye dove dark chocolates,1
_d4l need this pls,1
Save some for us.,1
OOOOOOH!!! I am buying all of these.,1
YES TEXAS GRILL FRITOS!!!,1
nat should try theses,1
Omg this looks amazing,1
Oh no what were they like? Where did you find them?,1
Where can I get these???? Im in GREENWICH CT.,1
Im taking what I feel like I need until the next time I find those bottles at that price...Im clearing the whole damn shelf.,1
Right has got all I want in the world,1
remember the 3D Doritos? Yep. Please bring them back,1
Ill take those Tim Tams! Have you tried their mint?!?!,1
Especially when you drive!,1
Just got my first bottle of this today,1
:( save me some tacos :(,1
.twitter.com/x9vjUWCHID,1
DAMN COOL & AMAZING SHOT,1
Where can I get these,1
Well I have potato chips and a bottle of sriracha #improvise,1
OMG needing these rn!!,1
WTF BRING ME,1
"Happy Birthday Ndamukong Suh, now get Shaun Marion from Buffalo and JJ Watt from Texas to help you",1
Yumm I want to eat this right now,1
omggg i want oneee or something like thissss,1
lol y'all give me a sec I'm coming I gotta get more pictures and stuff,1
All deb estar yo.,1
Sis u are beyond beautiful! I didnt even read cause I was stunned by your beauty,1
We need a store in Mexico,1
O man!!! Had our shopping delivered on Thurs nite and they subsituted them for oreo eggs proper livid I was,1
Ahhhh might have to try them,1
Yooooo. Shawt bus shawty and the Andy Milaknockis show,1
Haye i want it,1
Thanks for the reminder! I just found that in the bottom of my purse,1
Wow. You got hit by the auto comments big time! I just got this bottle as well. Cant wait to try it out,1
Happy Birthday Phil.,1
How to buy,1
Awesome. When will Cadburys realise we want this in Uk stores,1
Did they get clearance from for this remake??,1
I WANT MORE OF THIS!!!!,1
